ffff1989d22b9c00 2982421452 C Co:3:002:0 0 3 >

TYON_REPORT_ID_CONTROL:
ffff1989d22b9c00 2982624552 S Ci:3:002:0 s a1 01 0304 0000 0003 3 <
ffff1989d22b9c00 2982625780 C Ci:3:002:0 0 3 = 040100

TYON_REPORT_ID_PROFILE_BUTTONS:
ffff1989d22b9c00 2982626019 S Ci:3:002:0 s a1 01 0307 0000 0063 99 <
ffff1989d22b9c00 2982627019 C Ci:3:002:0 0 99 = 07630201 00000200 00030000 08000007 00004100 00820000 83000016 00001500


ffff1989d22b9c00 2982632762 S Co:3:002:0 s 21 09 0304 0000 0003 3 = 040380
ffff1989d22b9c00 2982633583 C Co:3:002:0 0 3 >

TYON_REPORT_ID_CONTROL:
ffff1989d22b8100 2982834401 S Ci:3:002:0 s a1 01 0304 0000 0003 3 <
ffff1989d22b8100 2982835093 C Ci:3:002:0 0 3 = 040100

ffff1989d22b8100 2982835207 S Ci:3:002:0 s a1 01 0306 0000 001e 30 <
ffff1989d22b8100 2982835774 C Ci:3:002:0 0 30 = 061e0300 06061f10 204080a4 00030300 00020200 00ff0002 0000ff00 f003

ffff1989d22b8100 2982835922 S Co:3:002:0 s 21 09 0304 0000 0003 3 = 040390
ffff1989d22b8100 2982836485 C Co:3:002:0 0 3 >

ffff1989d22b8100 2983039008 S Ci:3:002:0 s a1 01 0304 0000 0003 3 <
ffff1989d22b8100 2983040629 C Ci:3:002:0 0 3 = 040100

ffff1989d22b8100 2983041084 S Ci:3:002:0 s a1 01 0307 0000 0063 99 <
ffff1989d22b8100 2983042185 C Ci:3:002:0 0 99 = 07630301 00000200 00030000 08000007 00004100 00820000 83000016 00001500

ffff1989d22b8100 2983047911 S Co:3:002:0 s 21 09 0304 0000 0003 3 = 040480
ffff1989d22b8100 2983048746 C Co:3:002:0 0 3 >

ffff1989d22b8100 2983251587 S Ci:3:002:0 s a1 01 0304 0000 0003 3 <
ffff1989d22b8100 2983252752 C Ci:3:002:0 0 3 = 040100

ffff1989d22b8100 2983253102 S Ci:3:002:0 s a1 01 0306 0000 001e 30 <
ffff1989d22b8100 2983254185 C Ci:3:002:0 0 30 = 061e0400 06061f10 204080a4 00030300 00020200 00ff0002 0000ff00 f103

ffff1989d22b8100 2983254365 S Co:3:002:0 s 21 09 0304 0000 0003 3 = 040490
ffff1989d22b8100 2983255153 C Co:3:002:0 0 3 >

ffff1989d22b9c00 2983455551 S Ci:3:002:0 s a1 01 0304 0000 0003 3 <
ffff1989d22b9c00 2983456452 C Ci:3:002:0 0 3 = 040100

ffff1989d22b9c00 2983456645 S Ci:3:002:0 s a1 01 0307 0000 0063 99 <
ffff1989d22b9c00 2983457262 C Ci:3:002:0 0 99 = 07630401 00000200 00030000 08000007 00004100 00820000 83000016 00001500

