ffff1989d0421700 3207398752 S Co:3:002:0 s 21 09 0306 0000 001e 30 = 061e0000 06061f10 204080a4 00030300 040108f7 79000003 5c18e600 c304
ffff1989d0421700 3207399218 C Co:3:002:0 0 30 >
ffff1989d0421700 3207599513 S Ci:3:002:0 s a1 01 0304 0000 0003 3 <
ffff1989d0421700 3207600525 C Ci:3:002:0 0 3 = 040300
ffff1989c66a0100 3208104393 S Ci:3:002:0 s a1 01 0304 0000 0003 3 <
ffff1989c66a0100 3208105684 C Ci:3:002:0 0 3 = 040100
ffff1989d0421900 3208118337 S Co:3:002:0 s 21 09 0306 0000 001e 30 = 061e0200 06061f10 204080a4 00030300 00020005 90fe0000 0590fe00 1305
ffff1989d0421900 3208118993 C Co:3:002:0 0 30 >
ffff1989d0421900 3208319204 S Ci:3:002:0 s a1 01 0304 0000 0003 3 <
ffff1989d0421900 3208320397 C Ci:3:002:0 0 3 = 040300
ffff1989d0421900 3208822071 S Ci:3:002:0 s a1 01 0304 0000 0003 3 <
ffff1989d0421900 3208823708 C Ci:3:002:0 0 3 = 040100
ffff1989d3cde600 3208835390 S Co:3:002:0 s 21 09 0306 0000 001e 30 = 061e0300 06061f10 204080a4 00030300 00020005 90fe0000 0590fe00 1405
ffff1989d3cde600 3208836098 C Co:3:002:0 0 30 >
ffff1989d3cde600 3209038552 S Ci:3:002:0 s a1 01 0304 0000 0003 3 <
ffff1989d3cde600 3209040465 C Ci:3:002:0 0 3 = 040100
ffff1989d3cde600 3209050466 S Co:3:002:0 s 21 09 0306 0000 001e 30 = 061e0400 06061f10 204080a4 00030300 00020005 90fe0000 0590fe00 1505
ffff1989d3cde600 3209050980 C Co:3:002:0 0 30 >
ffff1989d3cded00 3209251867 S Ci:3:002:0 s a1 01 0304 0000 0003 3 <
ffff1989d3cded00 3209253342 C Ci:3:002:0 0 3 = 040300
ffff1989d3cde900 3209757668 S Ci:3:002:0 s a1 01 0304 0000 0003 3 <
ffff1989d3cde900 3209758947 C Ci:3:002:0 0 3 = 040100

