ffff1989cc13a600 206446597 S Ci:3:002:0 s a1 01 0305 0000 0003 3 <
ffff1989cc13a600 206447061 C Ci:3:002:0 0 3 = 050300
ffff1989cc13a600 206447893 S Co:3:002:0 s 21 09 0304 0000 0003 3 = 040080
ffff1989cc13a600 206448252 C Co:3:002:0 0 3 >
ffff1989cc13a600 206649907 S Ci:3:002:0 s a1 01 0304 0000 0003 3 <
ffff1989cc13a600 206651089 C Ci:3:002:0 0 3 = 040100
ffff1989cc13a600 206651187 S Ci:3:002:0 s a1 01 0306 0000 001e 30 <
ffff1989cc13a600 206652102 C Ci:3:002:0 0 30 = 061e0000 06061f10 204080a4 00030301 03020005 90fe0000 0590fe00 1505
ffff1989cc13a600 206652225 S Co:3:002:0 s 21 09 0304 0000 0003 3 = 040090
ffff1989cc13a600 206653006 C Co:3:002:0 0 3 >
ffff1989cc13a600 206854065 S Ci:3:002:0 s a1 01 0304 0000 0003 3 <
ffff1989cc13a600 206855043 C Ci:3:002:0 0 3 = 040100
ffff1989cc13a600 206855099 S Ci:3:002:0 s a1 01 0307 0000 0063 99 <
ffff1989cc13a600 206857433 C Ci:3:002:0 0 99 = 07630001 00000200 00030000 08000007 00004100 00820000 83000016 00001500
ffff1989cc13a600 206862947 S Co:3:002:0 s 21 09 0304 0000 0003 3 = 040180
ffff1989cc13a600 206863689 C Co:3:002:0 0 3 >
ffff1989cc13a600 207064935 S Ci:3:002:0 s a1 01 0304 0000 0003 3 <
ffff1989cc13a600 207066037 C Ci:3:002:0 0 3 = 040100
ffff1989cc13a600 207066107 S Ci:3:002:0 s a1 01 0306 0000 001e 30 <
ffff1989cc13a600 207067925 C Ci:3:002:0 0 30 = 061e0100 06061f10 204080a4 00030300 01020005 90fe0000 0590fe00 1305
ffff1989cc13a600 207068504 S Co:3:002:0 s 21 09 0304 0000 0003 3 = 040190
ffff1989cc13a600 207069623 C Co:3:002:0 0 3 >
ffff1989cc13a600 207269826 S Ci:3:002:0 s a1 01 0304 0000 0003 3 <
ffff1989cc13a600 207271167 C Ci:3:002:0 0 3 = 040100
ffff1989cc13a600 207271276 S Ci:3:002:0 s a1 01 0307 0000 0063 99 <
ffff1989cc13a600 207272285 C Ci:3:002:0 0 99 = 07630101 00000200 00030000 08000007 00004100 00820000 83000016 00001500
ffff1989cc13a600 207276792 S Co:3:002:0 s 21 09 0304 0000 0003 3 = 040280
ffff1989cc13a600 207277245 C Co:3:002:0 0 3 >
ffff1989cc13a600 207480307 S Ci:3:002:0 s a1 01 0304 0000 0003 3 <
ffff1989cc13a600 207481459 C Ci:3:002:0 0 3 = 040100
ffff1989cc13a600 207481517 S Ci:3:002:0 s a1 01 0306 0000 001e 30 <
ffff1989cc13a600 207482206 C Ci:3:002:0 0 30 = 061e0200 06061f10 204080a4 00030300 010207ff 00000007 ff000000 fa03
ffff1989cc13a600 207482315 S Co:3:002:0 s 21 09 0304 0000 0003 3 = 040290
ffff1989cc13a600 207482818 C Co:3:002:0 0 3 >
ffff1989cc13a600 207683837 S Ci:3:002:0 s a1 01 0304 0000 0003 3 <
ffff1989cc13a600 207684957 C Ci:3:002:0 0 3 = 040100
ffff1989cc13a600 207685039 S Ci:3:002:0 s a1 01 0307 0000 0063 99 <
ffff1989cc13a600 207686247 C Ci:3:002:0 0 99 = 07630201 00000200 00030000 08000007 00004100 00820000 83000016 00001500
ffff1989cc13a600 207692560 S Co:3:002:0 s 21 09 0304 0000 0003 3 = 040380
ffff1989cc13a600 207693467 C Co:3:002:0 0 3 >
ffff1989cc13a600 207894101 S Ci:3:002:0 s a1 01 0304 0000 0003 3 <
ffff1989cc13a600 207894759 C Ci:3:002:0 0 3 = 040100
ffff1989cc13a600 207894802 S Ci:3:002:0 s a1 01 0306 0000 001e 30 <
ffff1989cc13a600 207895322 C Ci:3:002:0 0 30 = 061e0300 06061f10 204080a4 00030300 01020b00 ff00000b 00ff0000 0304
ffff1989cc13a600 207895380 S Co:3:002:0 s 21 09 0304 0000 0003 3 = 040390
ffff1989cc13a600 207895818 C Co:3:002:0 0 3 >
ffff1989cc13a600 208096950 S Ci:3:002:0 s a1 01 0304 0000 0003 3 <
ffff1989cc13a600 208098550 C Ci:3:002:0 0 3 = 040100
ffff1989cc13a600 208098628 S Ci:3:002:0 s a1 01 0307 0000 0063 99 <
ffff1989cc13a600 208099999 C Ci:3:002:0 0 99 = 07630301 00000200 00030000 08000007 00004100 00820000 83000016 00001500
ffff1989cc13a600 208105027 S Co:3:002:0 s 21 09 0304 0000 0003 3 = 040480
ffff1989cc13a600 208105598 C Co:3:002:0 0 3 >
ffff1989cc13a600 208309105 S Ci:3:002:0 s a1 01 0304 0000 0003 3 <
ffff1989cc13a600 208310306 C Ci:3:002:0 0 3 = 040100
ffff1989cc13a600 208310384 S Ci:3:002:0 s a1 01 0306 0000 001e 30 <
ffff1989cc13a600 208311335 C Ci:3:002:0 0 30 = 061e0400 06061f10 204080a4 00030300 01020200 00ff0002 0000ff00 f203
ffff1989cc13a600 208311420 S Co:3:002:0 s 21 09 0304 0000 0003 3 = 040490
ffff1989cc13a600 208312209 C Co:3:002:0 0 3 >
ffff1989cc13a600 208515720 S Ci:3:002:0 s a1 01 0304 0000 0003 3 <
ffff1989cc13a600 208516803 C Ci:3:002:0 0 3 = 040100
ffff1989cc13a600 208516855 S Ci:3:002:0 s a1 01 0307 0000 0063 99 <
ffff1989cc13a600 208517945 C Ci:3:002:0 0 99 = 07630401 00000200 00030000 08000007 00004100 00820000 83000016 00001500
ffff1989c2bca300 227180934 S Co:3:002:0 s 21 09 0306 0000 001e 30 = 061e0000 06061f10 204080a4 00030301 010208f7 79000004 8118e600 e804
ffff1989c2bca300 227181325 C Co:3:002:0 0 30 >
ffff1989c2bca300 227381562 S Ci:3:002:0 s a1 01 0304 0000 0003 3 <
ffff1989c2bca300 227382808 C Ci:3:002:0 0 3 = 040300
ffff1989c2bca300 227883923 S Ci:3:002:0 s a1 01 0304 0000 0003 3 <
ffff1989c2bca300 227885279 C Ci:3:002:0 0 3 = 040100
ffff1989cc13bf00 238433279 S Co:3:002:0 s 21 09 0306 0000 001e 30 = 061e0000 06061f10 204080a4 00030300 010208f7 79000004 8118e600 e704
ffff1989cc13bf00 238433669 C Co:3:002:0 0 30 >
ffff1989d1f81800 238636426 S Ci:3:002:0 s a1 01 0304 0000 0003 3 <
ffff1989d1f81800 238637595 C Ci:3:002:0 0 3 = 040100
